User,Text,Date,Favorites,Retweets,Mentions,HashTags
jairbolsonaro,A MÍDIA & A ESQUERDA:,2016-10-31 14:57:02+00:00,230,702,,
jairbolsonaro,"Não anule seu voto. Escolha o melhor ou o ""menos ruim"". O PSOL é o que há de pior na política.",2016-10-30 14:37:16+00:00,242,728,,
jairbolsonaro,"Nas redes sociais, a ""Globo golpista"" em peso apoiando Freixo! ! A desinformação é a maior arma da esquerda! Tem gente q gosta d apanhar?",2016-10-30 14:04:04+00:00,448,1207,,
jairbolsonaro,"JOGO D PALAVRAS: canalhas tentam a todo custo desinformar, utilizando-se d aparente boa fé e politicamente correto p/enterrar seus inimigos!",2016-10-30 13:40:21+00:00,153,650,,
jairbolsonaro,"Bom final de semana, pessoal!",2016-10-28 20:15:33+00:00,1237,2956,,
jairbolsonaro,BOLSONARO XENÓFOBO OU SEM DEMAGOGIA? Inglesa adota refugiado s/ pesquisa de vida pregressa e descobre q era um jihadista treinado...,2016-10-27 20:45:59+00:00,241,718,,
jairbolsonaro,"Já somos mais de 300.000 no Twitter. Obrigado pela confiança e consideração!!! Abraços, JB!",2016-10-27 18:40:25+00:00,294,1887,,
jairbolsonaro,"""Devemos medir o sucesso de programas sociais pelo n• d pessoas q deixam d recebe-lo e ñ pelo n• d pessoas q são adicionadas!"" Ronald Reagan",2016-10-27 16:55:27+00:00,501,1278,,
jairbolsonaro,"ISSO É PIÇÓU: Pior que a corrupção, será o dia em que eles tomarem nossa liberdade.",2016-10-27 09:43:50+00:00,509,1079,,
jairbolsonaro,Essa molecada é o combustível que nos faz acreditar que é possível um Brasil melhor.,2016-10-26 19:00:44+00:00,220,1032,,
jairbolsonaro,"Tendo a satisfação de receber em meu gabinete, ESTUDANTES DE VERDADE, estudantes da Faculdade Paranaense Francisco Beltrão.",2016-10-25 17:10:44+00:00,391,1503,,
jairbolsonaro,À NAÇÃO RUBRO-NEGRA. JUNTOS PELO BRASIL! #ForaPiçóu,2016-10-25 11:36:45+00:00,305,694,,#ForaPi
jairbolsonaro,"""Não podemos fazer do Brasil a casa da mãe Joana!"", diz Bolsonaro sobre imigração descontrolada:",2016-10-22 23:12:59+00:00,397,1305,,
jairbolsonaro,Aeroporto de Congonhas hoje pela manhã. Obrigado São Paulo. C/ @BolsonaroSP e @CarlosBolsonaro,2016-10-22 21:47:44+00:00,491,1410,@BolsonaroSP @CarlosBolsonaro,
jairbolsonaro,"Formatura - novos Soldados da PMERJ. Grato pelo carinho e consideração. Brasil acima de tudo, Deus acima de todos!",2016-10-21 17:36:52+00:00,395,1673,,
jairbolsonaro,Querem mais do que nunca jogar tudo na minha conta agora! ! Pq será? As máscaras estão caindo e eu estou muito preocupado! ,2016-10-21 14:30:06+00:00,299,1222,,
jairbolsonaro,Mais uma piadinha sem graça do site sensacionalista x realidade: ,2016-10-20 21:31:00+00:00,178,960,,
jairbolsonaro,Como ser um idiota útil:,2016-10-18 20:18:21+00:00,428,846,,
jairbolsonaro,"NO RIO E NO BRASIL: No Dia do Médico no Brasil, o q ele leva d presente é um tapa na cara do governo e seu dinheiro patrocinando ditaduras:",2016-10-18 17:15:17+00:00,175,503,,
jairbolsonaro,"PARA A ESQUERDA, NÃO IMPORTAM OS FATOS, SOMENTE SUA VONTADE. Entenda em apenas uma imagem:",2016-10-18 16:55:31+00:00,440,803,,
jairbolsonaro,Simplesmente parabéns!!!,2016-10-30 18:05:42+00:00,110,450,,
jairbolsonaro,"Já sabe o q fazer c/ seu voto! Estamos sempre dispostos a aprender e evoluir. Contudo, ignorância se combate c/ verdade. Chega d vitimismo!",2016-10-30 13:49:03+00:00,70,328,,
jairbolsonaro,ALIADO? Aquele q deu início ao desmascaramento do maior esquema de corrupção do Brasil! Mensalão do PT! #choramais #averdadetortura,2016-10-30 13:37:11+00:00,66,313,,#choramais #averdadetortura
jairbolsonaro,"Rio de Janeiro hoje é 10. #ForaPiçóu , a linha auxiliar do PT.",2016-10-30 12:30:42+00:00,143,353,,#ForaPi
jairbolsonaro,"A MÍDIA & A ESQUERDA: ""A IMPRENSA TENTA A TODO CUSTO COMPRAR A CORDA QUE IRÁ ENFORCA-LA.""",2016-10-29 23:07:18+00:00,150,517,,
jairbolsonaro,"Insanidade, mas é a realidade. Nós vivemos numa democracia? Caso positivo até quando? http://tinyurl.com/jlymxee",2016-10-28 21:28:12+00:00,88,336,,
jairbolsonaro,"PSOL que é o PT com Filtro do Instagram"".",2016-10-27 16:18:55+00:00,233,526,,
jairbolsonaro,"OCUPAÇÕES NAS ESCOLAS, A ESQUERDA APOSTA NO CAOS PELO PODER.",2016-10-27 15:33:24+00:00,132,327,,
jairbolsonaro,"VAQUEJADA: Aos que me criticam, gostaria que apontassem nomes para 2018, quem sabe eu passe a apoiar um desses santo nome. Estamos Juntos!",2016-10-26 08:51:05+00:00,185,1005,,
jairbolsonaro,"Entrevista ao @CanalDoOtario : governabilidade, saídas p/ o Brasil crescer, experiência política e mto mais. http://tinyurl.com/jv6338l",2016-10-25 15:39:25+00:00,75,270,@CanalDoOtario,
jairbolsonaro,"ARTIGO – Por que eu, brasileiro, sou um conservador. http://tinyurl.com/jb76uoq (via @BlogDoPim )",2016-10-24 11:14:23+00:00,107,311,,
jairbolsonaro,"Olhe o q países ñ têm e o q eles são e olhe o q o Brasil tem e o q ñ somos. A resposta está nessa mulher, assista.",2016-10-23 14:46:39+00:00,94,362,,
jairbolsonaro,Agradeço o convite e segue nossa participação do Fórum Liberdade e Democracia em SP.,2016-10-22 16:36:30+00:00,39,310,,
jairbolsonaro,Pesquisa espontânea - CNT / MDA - 19 de outubro:,2016-10-21 18:49:00+00:00,99,425,,
jairbolsonaro,Amanhã estaremos em São Paulo - SP:,2016-10-20 14:28:25+00:00,51,274,,
jairbolsonaro,"Grato novamente pela confiança! Um grande abraço, JB!",2016-10-20 14:13:34+00:00,59,329,,
jairbolsonaro,Grato pela consideração @joicehasselmann :,2016-10-20 14:07:42+00:00,70,395,@joicehasselmann,
jairbolsonaro,CHACINA CONTRA FAMÍLIA DE PM NO RJ. ESSE JOGO TEM QUE VIRAR! Via @BolsonaroSP,2016-10-19 16:48:52+00:00,184,447,@BolsonaroSP,
jairbolsonaro,Veja o testemunho de @blogdojefferson sobre o comportamento dos partidários do PSOL no sistema prisional.,2016-10-19 15:52:51+00:00,106,301,@blogdojefferson,
jairbolsonaro,O ETERNO AMOR ENTRE FHC & LULA: por que será?,2016-10-18 09:23:55+00:00,163,469,,
jairbolsonaro,"Assim como Dilma, hj Franklin Martins é acusado d fazer parte d esquema d corrupção! Por isso a divulgação do vídeo! Entendeu? E ñ, ñ basta! https://twitter.com/titaloos/status/788157888296587264",2016-10-17 23:24:04+00:00,94,410,,
jairbolsonaro,"Obrigado pelo carinho, Eliakin Lucas. Tremenda trabalheira! Um grande abraço:",2016-10-17 16:00:28+00:00,91,791,,
jairbolsonaro,"FÁTIMA BERNARDES, UM DEPOIMENTO COM A VERDADE E A RAZÃO:",2016-10-16 18:56:55+00:00,523,1482,,
jairbolsonaro,Revista Carta Capital: A parcialidade político-partidária em nome de um plano de poder? Tire suas conclusões! #ObrigadoMoro,2016-10-16 14:10:08+00:00,258,754,,#ObrigadoMoro
jairbolsonaro,"Juntamente com @OdeCarvalho , jamais apoiaríamos o politicamente correto.",2016-10-15 18:20:53+00:00,294,968,@OdeCarvalho,
jairbolsonaro,O voto em lista fechada é o fim da representatividade do parlamentar! E há alguns que inesperadamente defendem tal absurdo! ,2016-10-15 14:24:11+00:00,302,765,,
jairbolsonaro,A razão da existência do PSOL é tentar calar quem ñ compactue c seus ideais e mimimis! Sabemos há décadas! E o resto? Relativiza q tá blz!,2016-10-15 14:17:00+00:00,266,619,,
jairbolsonaro,Como esperado - é disso que estamos falando: as imagens falam por si. #EscolaSemPartidoJá #DoutrinaçãoIdeológicaNão,2016-10-14 17:06:39+00:00,133,446,,#EscolaSemPartidoJ #Doutrina
jairbolsonaro,"Enquanto parlamentares, prefeitos, governadores e presidente ignorarem a doutrinação marxista não melhoraremos a educação. PRESSÃO NELES!",2016-10-14 16:40:59+00:00,430,1296,,
jairbolsonaro,Piçóu diz que é alternativa independente do PT em suas propagandas caras de pau! Veja nossa reação:,2016-10-13 16:57:29+00:00,242,919,,
jairbolsonaro,"PSOL, PT, PC do B, Rede e demais esquerdopatas, deixem nossas crianças serem crianças, deixem nossas crianças em PAZ!",2016-10-12 23:35:18+00:00,471,1429,,
jairbolsonaro,"VEJA ESTÁ EM CAMPANHA ABERTA CONTRA BOLSONARO. Primeiro o coloca como populista e mt +, hj ridiculariza @FlavioBolsonaro descaradamente. Pq?",2016-10-11 09:43:12+00:00,115,505,@FlavioBolsonaro,
jairbolsonaro,"Logo mais detalhes! Aos q nos denigrem antes da consumação dos fatos, a latrina...",2016-10-10 18:45:48+00:00,107,501,,
jairbolsonaro,É BEM-VINDO O AUMENTO DA REPRESENTAÇÃO DA DIREITA ( OGLOBO - OPINIÃO):,2016-10-09 12:03:08+00:00,178,695,,
jairbolsonaro,Mais uma do psol no Rio de Janeiro: querem transformar o mercado de trabalho em disputa sexual. Via vereador @CarlosBolsonaro,2016-10-08 22:23:36+00:00,235,561,@CarlosBolsonaro,
jairbolsonaro,"Paulo Cintura, CUT e Jair Bolsonaro. Assista .....",2016-10-07 12:40:03+00:00,401,1213,,
jairbolsonaro,Apenas corrupção generalizada? NÃO! Desvio de seu dinheiro p/ bancar plano de poder absoluto socialista e de aliados! #olavotemrazão,2016-10-06 11:29:18+00:00,170,626,,#olavotemraz
jairbolsonaro,"Pelo jeito, mais um ""professor"" pregando amor e pelo jeito está muito apaixonado, note:",2016-10-06 11:08:13+00:00,414,874,,
jairbolsonaro,"Bom dia a todos: eletricistas, oftalmologistas, maquinistas e manobristas. Lembre-se que é GÓPI e ñ GOLPE, seu ""preconceituoso linguístico""!",2016-10-06 10:50:10+00:00,361,1288,,
jairbolsonaro,Começamos a coletânea! ! Responder à uma calúnia virou crime no mundo dos esquerdopatas! https://twitter.com/costa_flavio/status/783973173180129280,2016-10-06 10:34:13+00:00,56,248,,
jairbolsonaro,"Logo também homenagearei a ""esquerda mais amor, menos ódio""! Imaginem se tratássemos alguém assim? Ñ estaríamos nem cassados, mas na forca!",2016-10-06 10:05:14+00:00,169,479,,
jairbolsonaro,"A grata satisfação de receber a visita de Dadá Maravilha.""Ñ venha c/ a problemática q eu tenho a solucionática"".",2016-10-05 23:07:05+00:00,61,474,,
jairbolsonaro,"Mais uma da ""interminável"" série: NÃO HÁ DOUTRINAÇÃO IDEOLÓGICA NAS INSTITUIÇÕES DE ENSINO:",2016-10-05 12:28:15+00:00,332,815,,
jairbolsonaro,Entenda o contexto:,2016-10-05 01:42:19+00:00,64,250,,
jairbolsonaro,"A partir do momento em que Freixo quer voto do eleitor ético de Bolsonaro, vc percebe quem é o oportunista e mentiroso sobre os fatos de td!",2016-10-04 23:12:59+00:00,940,2357,,
jairbolsonaro,"""Obrigado a todos aqueles que apoiam o Estatuto do Desarmamento.""",2016-10-04 22:52:10+00:00,486,993,,
jairbolsonaro,Esse vídeo é somente para os comunistas apaixonados por Jandira Feghali (PCdoB / RJ). Proibida a sua visualização pela Direita:,2016-10-04 12:44:11+00:00,1305,3129,,
jairbolsonaro,Vereador @CarlosBolsonaro Vs Dragão da Lava Jato.,2016-10-04 10:26:43+00:00,163,575,@CarlosBolsonaro,
jairbolsonaro,"Caro Felipe, apenas trocaria radical por outro adjetivo: um grande abraço e continue o ótimo trabalho: o de expor a verdade!",2016-10-04 10:03:34+00:00,294,838,,
jairbolsonaro,"Olha quem quer ser o Prefeito do Rio de Janeiro. Se possível, retransmita. Um abraço a todos, JB.",2016-10-04 00:45:11+00:00,435,684,,
jairbolsonaro,Testado para 2018! Obrigado Rio de Janeiro! Um abraço Brasil! Vereador @CarlosBolsonaro Deputado Estadual @FlavioBolsonaro,2016-10-03 16:48:20+00:00,335,1460,@CarlosBolsonaro @FlavioBolsonaro,
jairbolsonaro,@CarlosBolsonaro é o vereador mais votado do Rio de Janeiro. Grato a todos pela confiança! http://tinyurl.com/jx3xkwh,2016-10-03 12:05:05+00:00,127,460,@CarlosBolsonaro,
jairbolsonaro,O q se esperar das eleições presidenciais de 2018? O Brasil tem cura? C/ o Deputado Estadual (RJ) @FlavioBolsonaro .,2016-10-02 23:31:43+00:00,97,485,@FlavioBolsonaro,
jairbolsonaro,"Acabamos de fazer uma live no facebook sobre pesquisas eleitorais 2016, eleições 2018 e muito mais. Assista:",2016-10-01 23:10:52+00:00,112,589,,
jairbolsonaro,Grato pela consideração e confiança! https://twitter.com/reaconaria/status/782269910730801152,2016-10-01 19:35:32+00:00,120,444,,
jairbolsonaro,Obrigado sempre pela consideração! Este é nosso combustível! https://twitter.com/larissasfp/status/782242210708393984,2016-10-01 15:46:57+00:00,59,348,,
jairbolsonaro,Esse aprendeu a fazer contas c/ professor esquedista! ,2016-10-01 14:30:04+00:00,57,233,,
jairbolsonaro,"Eles estão em todos os lugares... os idiotas úteis (mentirosos, desinformantes ou burros mesmo)! Ñ importa, eles estão em todos os lugares! https://twitter.com/ofernandopaiva/status/782217881689976832",2016-10-01 14:18:37+00:00,55,277,,
jairbolsonaro,"COMO VOTAR NO RIO DE JANEIRO. SE POSSÍVEL, É CLARO. AGRADEÇO A CONFIANÇA E CONSIDERAÇÃO. Com @CarlosBolsonaro e @FlavioBolsonaro",2016-10-01 13:41:27+00:00,299,760,@CarlosBolsonaro @FlavioBolsonaro,
