User,Text,Date,Favorites,Retweets,Mentions,HashTags
naosalvo,Eu quero que vcs me mandem spoiler para que se libertem disso e não estraguem o filme dos seus amiguinhos. Descarreguem os spoilers em mim. Eu estou me sacrificando pela humanidade aqui! Alo @Pontifex,2018-04-30 19:08:57+00:00,18,534,@Pontifex,
naosalvo,To indo assistir guerra infinita. Me mandem spoilers ai. Todos. To nem ai.,2018-04-30 19:00:01+00:00,21,540,,
naosalvo,Q homem,2018-04-30 18:44:07+00:00,0,1,,
naosalvo,,2018-04-30 12:50:35+00:00,514,1474,,
naosalvo,Aquele momento que vc percebe que esta ha 40min rolando o explorar do Instagram sem motivo aparente,2018-04-30 05:04:57+00:00,131,787,,
naosalvo,-Você é a menina mais linda que eu conheço -Quer dizer que tem alguma mais bonita que vc ainda vai conhecer?,2018-04-30 04:37:53+00:00,97,923,,
naosalvo,,2018-04-29 16:40:18+00:00,3460,7766,,
naosalvo,Kct meu kct kctudo fui pedir um uber pro metro Barra Funda e selecionou um bar chamado Metro Barra Funda no MATO GROSSO DO SUL kcttttt meu cartão,2018-04-29 01:28:19+00:00,191,2017,,
naosalvo,Ai já é doença https://twitter.com/craisck/status/990034135195451392,2018-04-28 19:34:58+00:00,111,1009,,
naosalvo,HAHAHAHAHAHAH,2018-04-28 18:19:34+00:00,69,455,,
naosalvo,As atualizações de Pokemon Go estão cada vez mais realistas.... ta loko,2018-04-28 07:13:25+00:00,441,1947,,
naosalvo,falso cid!!!,2018-04-28 04:50:48+00:00,0,12,,
naosalvo,Infelizmente algumas temporadas dos nossos programas favoritos ainda não chegaram na @NetflixBrasil,2018-04-27 23:05:36+00:00,79,723,@NetflixBrasil,
naosalvo,Qdo comenta MIM NOTA ele morre de forma violenta,2018-04-27 22:56:13+00:00,14,434,,
naosalvo,HAHAHAHAH em portuguese ficou show,2018-04-27 14:34:44+00:00,68,618,,
naosalvo,HAHAHAHAH,2018-04-27 14:31:31+00:00,0,21,,
naosalvo,Se chamaria CONFISCO. Com trilha sonora do Charlie Brown e apresentado por mim e o @YudiTamashiiro. Aguardando a ligação da Endemol,2018-04-26 18:51:07+00:00,18,585,@YudiTamashiiro,
naosalvo,"Ideia: Um reality show que um cara confisca o celular e o computador de uma pessoa e fica analisando as coisas que vc ja visitou e tem salvas em um telão para todos seus familiares, sua noiva e a família dela, minutos antes do casamento.",2018-04-26 18:45:12+00:00,230,2013,,
naosalvo,"Não tenho disquete, não poderei fazer o imposto de renda esse ano, professor",2018-04-26 18:15:37+00:00,14,349,,
naosalvo,Pq vc não colocou emoji no Boa Noite? Vc não me ama mais?,2018-04-26 07:13:51+00:00,249,1302,,
naosalvo,Um dia vc vai ter que se secar com o secador de mão que faz ventinho. Ja aconteceu cmg,2018-04-30 19:00:54+00:00,0,40,,
naosalvo,Voce ja foi tão longe que ta vendo vídeo de satisfaction de cara apertando massinha com o pau,2018-04-30 05:05:45+00:00,8,271,,
naosalvo,Hahahaha eu escutaria,2018-04-30 04:50:00+00:00,1,18,,
naosalvo,Eu to me divertindo fazendo essa serie de Desenhando Logos no YouTube,2018-04-29 19:41:16+00:00,0,147,,
naosalvo,Qqqqqqqqq,2018-04-29 16:10:43+00:00,0,14,,
naosalvo,Eu acordei em Ribeirão Preto!,2018-04-29 15:45:37+00:00,0,6,,
naosalvo,Faz sentido,2018-04-29 01:58:41+00:00,0,63,,
naosalvo,Ótimo avatar e nick,2018-04-28 19:45:03+00:00,1,10,,
naosalvo,COOOÓOOOÉ,2018-04-28 19:33:58+00:00,0,7,,
naosalvo,um que chama 1 2 3 de oliveira 4 eu acho,2018-04-28 06:40:44+00:00,0,2,,
naosalvo,1. Tudo 2. Tudo 3. Tudo,2018-04-27 22:55:32+00:00,0,20,,
naosalvo,Que bênção!,2018-04-27 22:54:25+00:00,2,22,,
naosalvo,Oqqqq,2018-04-27 19:32:53+00:00,0,9,,
naosalvo,Jesusamado,2018-04-27 17:12:57+00:00,0,25,,
naosalvo,VOCÊ CONSEGUE DESENHAR ESSE LOGO DE CABEÇA? PARTE 03: http://youtu.be/-2CbAXXx0do?a via @YouTube,2018-04-27 14:03:40+00:00,9,176,@YouTube,
naosalvo,Wuuuuaaaa ha ha haaa,2018-04-26 18:56:28+00:00,0,9,,
naosalvo,"Vc sera o primeiro participante, fica esperto",2018-04-26 18:54:12+00:00,0,72,,
naosalvo,Se nao fosse eu nem falava,2018-04-26 18:47:15+00:00,0,51,,
naosalvo,TESÃO,2018-04-26 18:46:25+00:00,0,15,,
naosalvo,Chato no nivel de querer que a pessoa viva em função de te dar atenção. Não mesmo. Deus me livre.,2018-04-26 18:08:30+00:00,3,14,,
naosalvo,vocês,2018-04-26 01:38:05+00:00,195,709,,
naosalvo,O da direita tá de coque samurai,2018-04-26 00:08:33+00:00,35,322,,
naosalvo,"Eu não aguento mais, corta meu pinto",2018-04-26 00:01:59+00:00,250,1176,,
naosalvo,O CORINTHIANS E O LULA COMPRARAM TODAS AS EMISSORASSSSS ASSIM NAO DAAAA MAIS PRA VER FUTEBOL!!!!,2018-04-25 23:19:53+00:00,5,91,,
naosalvo,"o BR não consegue gostar de uma coisa de forma normal.... Naooooo, é claro que tem que inventar moda hxuhahahahahahaha",2018-04-25 21:43:21+00:00,108,533,,
naosalvo,Ele matou o cara 3 vezes! Ta loko,2018-04-25 21:33:14+00:00,13,307,,
naosalvo,"Brasileiro, o gafanhoto digital",2018-04-25 19:44:44+00:00,234,1048,,
naosalvo,Quem deve se preocupar é o outro lado hahahaha,2018-04-25 19:21:43+00:00,0,215,,
naosalvo,Vou fazer um vídeo no yourube lendo o texto hahahah,2018-04-25 19:19:11+00:00,0,131,,
naosalvo,Seu futuro será brilhante,2018-04-25 19:17:39+00:00,4,391,,
naosalvo,"Marcos tu é chato para um caralhoooooo meu deus, não seja um Marcos",2018-04-25 19:13:33+00:00,1258,4551,,
naosalvo,A moda do Gastei X reais pra fazer tal coisa do Youtube ja passou? Era um otimo conteúdo para a receita federal.,2018-04-25 18:24:59+00:00,37,458,,
naosalvo,Ah mano,2018-04-25 18:22:00+00:00,13,113,,
naosalvo,"Escolha 1 pra te defender, os outros 3 irão te atacar. Coxinha, Trakinas, Minecraft ou Jujubaboy.",2018-04-25 18:19:36+00:00,428,1481,,
naosalvo,Um dia eu quero ter metade da confiança e amor próprio que o Ibrahimovic tem.......... ele fala dele mesmo como um Chuck Norris do Esporte. É sensacional ausfhuiahsfahf https://www.youtube.com/watch?v=Q1TXk7ZdiQE,2018-04-25 05:33:04+00:00,15,182,,
naosalvo,Bem feliz do titulo com que esse video foi upado no youtube,2018-04-25 03:01:44+00:00,38,962,,
naosalvo,Agora que ta 10cm mais alta vc n vai reconhecer....,2018-04-25 02:14:12+00:00,0,66,,
naosalvo,"Deixa um comentario la no video, se tiver mais de 300 likes eu penso no teu assunto",2018-04-25 02:11:57+00:00,2,175,,
naosalvo,"ae santos, da uma camisa pro menino que ele merece, sempre ta falando do Santos na TL (de preferencia autografada ne!!!)",2018-04-25 01:39:25+00:00,1,149,,
naosalvo,.........SIM,2018-04-25 01:38:23+00:00,784,3680,,
naosalvo,Esse foi o dia da apresentação do jogador,2018-04-25 01:25:50+00:00,0,109,,
naosalvo,­,2018-04-25 00:15:20+00:00,148,588,,
naosalvo,E pensar que o Salah foi revelado no Paysandu hein,2018-04-24 19:33:48+00:00,7496,19668,,
naosalvo,Pastor faz baixinha crescer 10 centímetros somente com o poder da oração Eu ouvi um amem???????,2018-04-24 19:12:58+00:00,66,321,,
naosalvo,VOCÊ CONSEGUE DESENHAR ESSE LOGO DE CABEÇA? PARTE 02: http://youtu.be/h-pnS7__ivc?a via @YouTube,2018-04-24 18:59:48+00:00,12,202,@YouTube,
naosalvo,"Eu nasci pra ser VJ, me da um programa MTV",2018-04-24 17:22:01+00:00,1,124,,
naosalvo,Q isso Lucas,2018-04-24 07:50:56+00:00,1,115,,
naosalvo,"No meu: E a regra para nomes repetidos na escola é bem clara. Assim como a regra pra quem é achada na rua ter que obrigatoriamente se chamar Vitória / Esperança, ou pra quem é encontrado em uma caçamba ter que ser chamado de Caçambito.",2018-04-24 07:22:03+00:00,13,322,,
naosalvo,"O que tem no seu Crtl V agora? Manda ai... pega nada, ninguem vai ler",2018-04-24 07:21:11+00:00,22,344,,
naosalvo,Madrugada e meu cérebro ta assim,2018-04-24 05:35:59+00:00,303,974,,
naosalvo,Não fui eu Mas poderia,2018-04-24 01:13:08+00:00,73,558,,
naosalvo,Se precisar eu conheço um cara que faz o reboco barato,2018-04-24 00:33:17+00:00,1,79,,
naosalvo,Vai apresentar o Cidade Alerta?,2018-04-24 00:32:15+00:00,4,197,,
naosalvo,Quem não tem Mundial de Clubes melhor correr ate 2021 porque depois vai ser complicado viu....,2018-04-23 23:46:12+00:00,30,172,,
naosalvo,Uma pessoa é velha a partir de ter nascido em qual ano?,2018-04-23 22:42:09+00:00,41,736,,
naosalvo,Me recuso fazer uma assim la pro http://naogasto.com.br hahauahah,2018-04-23 22:27:50+00:00,6,201,,
naosalvo,"No youtube é diferente, vai me desculpar",2018-04-23 22:25:41+00:00,10,678,,
naosalvo,WTF,2018-04-23 22:25:26+00:00,16,277,,
naosalvo,"Uma vez entrei numa discussão sobre roupa de cor preta que segundo a pessoa SUJA MENOS. Eu falei que suja igual qualquer outra cor a diferença é que a gente não ve! O que os olhos não veem o coração não sente, ele me respondeu. Só uso roupa preta desde então.",2018-04-23 18:26:15+00:00,153,1585,,
naosalvo,Esse vídeo é muito bom hahahaha pqp É melhor Jair Externinando,2018-04-23 16:24:06+00:00,17,304,,
naosalvo,HAHAHAHAha ja podemos ter uma versão O Exterminador no Brasil!,2018-04-23 16:06:54+00:00,88,761,,
naosalvo,Se o RadioHead fosse BR provavelmente tocaria forró. E coooom vocês.... BANDA CABEÇA DE RÁDIN!,2018-04-23 05:10:00+00:00,144,1017,,
naosalvo,Por que ninguem me faz uma surpresa dessas?!?!?! =(,2018-04-23 04:54:57+00:00,365,1758,,
naosalvo,As ruas conhecem a minha história! NÃO VOU ME CALAR!!!,2018-04-22 20:15:42+00:00,151,3062,,
naosalvo,"Ué, qq eu fiz",2018-04-22 20:13:59+00:00,631,6081,,
naosalvo,Prisão perpétua agora mesmo,2018-04-22 19:36:16+00:00,0,86,,
naosalvo,Dependendo do nome do filho já são 2 crimes,2018-04-22 19:25:53+00:00,10,324,,
naosalvo,Muita gente me pergunta: A partir de quantas tatuagens uma pessoa vira criminosa? Uma.,2018-04-22 19:23:57+00:00,383,2678,,
naosalvo,Existe licença poética em viagens,2018-04-22 19:03:14+00:00,2,128,,
naosalvo,A ciência ta tão avançada mas não consegue explicar como pode entrar um mosquito em casa se ta tudo fechado há 5 dias,2018-04-22 19:00:04+00:00,117,926,,
naosalvo,O Hannibal começou a fazer lowcarb e não ta passando bem =(,2018-04-22 18:03:35+00:00,51,436,,
naosalvo,Os caras apagam todos os patrocinadores ds camisa do Ceará e o entrevistado parece que é um fantasma,2018-04-22 16:18:57+00:00,58,803,,
naosalvo,Nostalgia Nicolas Cage,2018-04-22 16:11:16+00:00,4,285,,
naosalvo,Que homem,2018-04-22 15:53:07+00:00,0,11,,
naosalvo,"A Nova novela das 6: Sobreviveu aos cachorros, mas não ao destino",2018-04-22 15:09:11+00:00,11,158,,
naosalvo,Todo dia agora tem essa palhaçada de amanhecer??? Vsf,2018-04-22 08:55:25+00:00,139,668,,
naosalvo,Puta merda como assim ta de dia,2018-04-22 08:51:52+00:00,86,427,,
naosalvo,Entre 5 e 5h30 não existe outro comentario na internet a não ser Vai dormir ow,2018-04-22 08:23:38+00:00,101,794,,
naosalvo,q patente!?!?!,2018-04-22 06:41:18+00:00,0,5,,
naosalvo,Contra fatos não há argumentos,2018-04-22 06:41:04+00:00,1593,5808,,
naosalvo,"Acredite nos seus sonhos Rafael, compre 2, e vao ao parque juntos. Eu te desafio.",2018-04-22 01:35:38+00:00,0,100,,
naosalvo,Yeyyys,2018-04-22 01:33:50+00:00,0,0,,
naosalvo,Olosko! essa fila! Britadeira bixo,2018-04-22 01:30:50+00:00,10,309,,
naosalvo,Camisa polo? To fora. Pego meu moletom e vou embora http://Naogasto.com.br ,2018-04-22 01:21:12+00:00,102,1518,,
naosalvo,RA TIM BOOOOOOOOOOOOOOOOM,2018-04-21 22:18:35+00:00,379,1312,,
naosalvo,Eu vou passando e fica: Gente gente gente gente gente,2018-04-21 18:45:31+00:00,2,101,,
naosalvo,Top 5 palavras mais ditas por D1G1T4L 1NFLU3NC3RS nos stories: #1 gente #2 meninas #3 galera #4 acabei de acordar #5 muita gente ta perguntando,2018-04-21 18:37:36+00:00,733,3977,,
naosalvo,Quando chega aquele amigo eclético na discussão,2018-04-21 17:58:14+00:00,444,2308,,
naosalvo,HAHAHAHAH,2018-04-21 17:56:22+00:00,0,4,,
naosalvo,Imagina transar sempre de camisa,2018-04-21 17:53:30+00:00,230,1233,,
naosalvo,Meu deus como ela é linda a minha linda,2018-04-21 17:14:51+00:00,2,113,,
naosalvo,Manda pra gata,2018-04-21 06:29:04+00:00,160,578,,
naosalvo,"Eu entendi já rlx. Fiz um search rápido no teu nick e vi a historia. Vc pegou o nick de uma pessoa que tinha conta verificada, e essa pessoa mudou de @, por isso que vc ainda usa o nome de Munik.... saquei! Era só ter falado antes po. Não precisava gastar Gif da Gretchen a toa",2018-04-21 06:20:13+00:00,0,25,,
naosalvo,"Repita essa frase varias vezes antes de dormir, vai te fazer bem hahaha vc ja ta no modo frases automáticas",2018-04-21 06:00:52+00:00,0,29,,
naosalvo,Ok. Mas ela não tá. E vc ainda não respondeu.. Pq a conta verificada se ela não é sua?,2018-04-21 05:57:19+00:00,0,28,,
naosalvo,Mss ninguém te perguntou,2018-04-21 05:49:54+00:00,1,41,,
naosalvo,"Amore, aceita, meu anjo rs Mas pq vc ainda tem a conta verificada entao, ja que é ""roubada""? Sabe explicar?",2018-04-21 05:45:52+00:00,0,38,,
naosalvo,Vc é aquele perfil que usou o msm nick da munik do BBB e acabou pegando o verificado por tabela?,2018-04-21 05:34:43+00:00,0,39,,
naosalvo,O avião ta caindo,2018-04-21 05:10:20+00:00,0,181,,
naosalvo,Sextou,2018-04-21 04:43:41+00:00,72,421,,
naosalvo,Explicação: Uma tampa de cimento voou para a estrada depois que explodiu de uma fábrica de cimento nas proximidades,2018-04-21 04:25:39+00:00,8,287,,
naosalvo,Pensa num cagaço,2018-04-21 04:25:39+00:00,82,560,,
naosalvo,O ano era 2009,2018-04-21 03:00:40+00:00,879,4186,,
naosalvo,Fica quieto ae tua mãe tinha pôster dos colirios na parede #xingamentosdofuturo,2018-04-21 01:35:00+00:00,60,425,,#xingamentosdofuturo
naosalvo,Pau de selfie,2018-04-21 00:50:23+00:00,3,302,,
naosalvo,??????????? O twitter é um lugar que sei la,2018-04-21 00:48:54+00:00,777,5644,,
naosalvo,Fiz um calculo cientifico e através de uma progressão matemática cheguei a conclusão que a cada perdigoto que voa da boca do @cauemoura durante os videos em todos esses anos fossem somados hoje existiram 3 baldes completos de saliva para se orgulhar.,2018-04-21 00:25:23+00:00,22,970,@cauemoura,
naosalvo,top 10 brasileiros de todos os tempos,2018-04-21 00:19:15+00:00,13,385,,
naosalvo,I know,2018-04-20 23:35:30+00:00,0,43,,
naosalvo,"Que isso Ricardo, vai vestir uma roupa",2018-04-20 23:34:47+00:00,3,295,,
naosalvo,Bro.... The Biel.... Old The Biel It's not possible This Biel Bro Look I will not even talk Kicking dead dog I do not feel like it any more What a crazy asshole (caso o tweet chegue na mina dele),2018-04-20 23:33:38+00:00,376,2905,,
naosalvo,Mano.... O Biel.... Véi O Biel Não é possível Esse Biel Mano Olha Vou nem falar Chutar cachorro morto da nem vontade mais Que maluco imbecil,2018-04-20 23:20:27+00:00,819,4473,,
naosalvo,Oi,2018-04-20 23:09:20+00:00,48,367,,
naosalvo,Antes de ficar reclamando do seu nariz lembre-se que o Owen Wilson é milionário com essa coisa na cara,2018-04-20 23:05:08+00:00,140,731,,
naosalvo,Melhor coisa da Internet atualmente se chama: GIFS TOSCOS DO STORIES,2018-04-20 22:52:17+00:00,32,345,,
naosalvo,"@lilraffbro tao te marcando nesse tweet, concorda?",2018-04-20 22:44:53+00:00,8,111,@lilraffbro,
naosalvo,Nós ainda somos carente de um Kanye West brasileiro.,2018-04-20 22:40:58+00:00,109,604,,
naosalvo,HAHAHAHAH,2018-04-20 22:04:07+00:00,0,0,,
naosalvo,hahahahahah,2018-04-20 22:03:49+00:00,0,0,,
naosalvo,"Dei a câmera na mão do meu pai pra ver oq dava, sem interferir..... Foi uma otima ideia HAHAHAHAH",2018-04-20 21:50:35+00:00,7,153,,
naosalvo,,2018-04-20 16:38:44+00:00,19,464,,
naosalvo,Hahahah pedido do @urgh,2018-04-20 15:44:30+00:00,0,9,@urgh,
naosalvo,Fácil demais No: http://www.naosalvo.com.br/batalhadebbb,2018-04-20 15:40:24+00:00,116,4857,,
naosalvo,"Droga, continua estranho",2018-04-20 05:14:44+00:00,2,374,,
naosalvo,"Eu escrevi umas 3 vezes um tweet e apaguei pq ele parecia errado se for mal interpretado mas vou arriscar pq sei q vcs são inteligentes... Ok? Eu ando curtindo muita foto de criança no Instagram, será que isso atrai?",2018-04-20 05:12:32+00:00,13,688,,
naosalvo,"Quem ve todos os stories sem áudio é burro demais, perde varios momentos bons, como por exemplo o barulho de vento",2018-04-20 05:05:55+00:00,19,347,,
naosalvo,Gleice acaba de ser eleita governadora do Acre! MEODEOS! QUE RAPIDO,2018-04-20 03:46:12+00:00,73,955,,
naosalvo,EU JÁ SABIA!!!!! GLEICE CAMPEÃÃAÃÃÃÃ~EU DISSSSEEEEEEE,2018-04-20 03:04:33+00:00,91,643,,
naosalvo,Votação do BBB já passou dos 12 bilhões de votos!!,2018-04-20 02:47:27+00:00,62,526,,
naosalvo,E agora chupetinha?,2018-04-20 02:16:46+00:00,525,2347,,
naosalvo,"Quem vai vencer o BBB18? (Pesquisa oficial, todas as outras enquetes, inclusive votação no site da globo, são falsas. Só essa vale. Quem ganhar ganhou. Real Oficial)",2018-04-20 01:09:58+00:00,14,108,,
naosalvo,Fale por você,2018-04-20 00:45:01+00:00,26,264,,
naosalvo,O carinho da torcida Versão BBB,2018-04-20 00:40:33+00:00,70,530,,
naosalvo,Lasanha Congelada: o melhor pior alimento,2018-04-20 00:35:02+00:00,157,948,,
naosalvo,"Sempre acontece ""Comprei um pinto gigante e não sei o que faço com ele""",2018-04-19 23:50:23+00:00,19,120,,
naosalvo,Se a moda pega metade do YouTube BR preso amanhã!,2018-04-19 19:10:38+00:00,76,721,,
naosalvo,"Trago nesse tweet uma verdade que vai chocar o Brasil. Jiripoca, da musica do Daniel: HOJE A JIRIPOCA VAI PIAR VAAAAIIIII... não é um pássaro",2018-04-19 18:58:42+00:00,69,395,,
naosalvo,"Na última atualização o uber colocou uma imagem do modelo do carro, oq é ótimo pra pessoas que não entendem nada de carro que nem eu. Isso abre um precedente para que em breve tenhamos uma atualização com uma foto real do motorista com o carro. Aguardo",2018-04-19 18:06:00+00:00,96,652,,
naosalvo,A única certeza é que depois de uma frase baixa vai vir uma risadinha,2018-04-19 17:36:03+00:00,7,154,,
naosalvo,Imagina um dialogo entre Gabriel Medina e Neymar depois de um baseado.... não sai nada,2018-04-19 17:33:10+00:00,34,319,,
naosalvo,Quando você vai rir mas sai um barulho de porco e precisa disfarçar com uma tosse pra ninguém te achar estranho,2018-04-19 16:33:30+00:00,394,2214,,
naosalvo,I M P E R D I V E L,2018-04-19 15:56:50+00:00,61,378,,
naosalvo,Meio? Repara que só bbk coloca digital influencer na bio,2018-04-19 15:49:02+00:00,9,274,,
naosalvo,5 bandas que pelo nome eu achava que eram gringas mas depois descobri que são BRs 1. DeadFish 2. Los Hermanos 3. Planet Hemp 4. Strike 5. Adriana e a Rapaziada,2018-04-19 06:23:57+00:00,242,2210,,
naosalvo,,2018-04-19 05:40:33+00:00,518,1356,,
naosalvo,Minha vida ta uma bagunça,2018-04-19 05:29:07+00:00,102,234,,
naosalvo,Não pergunte como mas achei meu carregador de celular dentro de uma caneca com sorvete,2018-04-19 05:28:57+00:00,7,274,,
naosalvo,VOU ME MUDAR PRA MIAMI E ASSISTIR FUTEBOL AMERICANO NAO AGUENTO MAIS TANTA CORRUPÇÃO,2018-04-19 03:09:47+00:00,15,159,,
naosalvo,"O Corinthians junto com o Lula e a pedido do Vampeta compraram todos os árbitros e bandeiras da América Latina além de todos os dirigentes da CBF e Conmebol e querem passar a Copa da Russia pra Itaquera, assim não da Agora esse Mateus Vital foi longe demais ",2018-04-19 02:53:07+00:00,757,2131,,
naosalvo,HAHAHAHAHA,2018-04-18 23:00:51+00:00,0,1,,
naosalvo,,2018-04-18 22:34:46+00:00,34,269,,
naosalvo,,2018-04-18 22:34:45+00:00,29,267,,
naosalvo,,2018-04-18 22:34:45+00:00,24,142,,
naosalvo,,2018-04-18 22:34:44+00:00,16,144,,
naosalvo,,2018-04-18 22:34:44+00:00,18,128,,
naosalvo,,2018-04-18 22:34:43+00:00,25,231,,
naosalvo,Thread de pais com reflexo appreciation,2018-04-18 22:34:42+00:00,242,1077,,
naosalvo,A Casa de Papel acabou no quinto episodio da segunda temporada!!! Só ficou animado com o anuncio da terceira temporada quem achou a cena da moto normal!!!!!!! Revoltado,2018-04-18 16:06:30+00:00,122,1034,,
naosalvo,Gostaria de fazer um anúncio importante: Mudei de ideia e to torcendo pro Kaysar. Fui influenciado pela materia da veja com a história dele.... https://veja.abril.com.br/entretenimento/kaysar-a-verdadeira-historia-do-refugiado-do-bbb/amp/?__twitter_impression=true,2018-04-18 16:00:42+00:00,503,2149,,
naosalvo,"Eu nao entendo nada de YouTube mas tenho um vídeo chamado ""Universo Gay"" que desde que saiu tinha automaticamente os anuncios bloqueados. Só pq tinha Gay no titulo. Hoje, depois de UM ANO, teve uma analise manual e liberaram o vídeo hahaha https://youtu.be/vmjpJtWnoO0",2018-04-18 15:50:12+00:00,17,403,,
naosalvo,,2018-04-18 04:46:11+00:00,141,441,,
naosalvo,Acredite nos seus sonhos,2018-04-18 02:36:28+00:00,28,542,,
naosalvo,#1 Gleice #2 Família #3 Kaysar Definido,2018-04-18 02:22:51+00:00,261,1626,,
naosalvo,Essa mulher tem uma raposa taxidermizada E depois de ver as fotos me parece uma otima ideia,2018-04-18 00:20:29+00:00,362,1879,,
naosalvo,complexo,2018-04-17 23:46:32+00:00,0,19,,
naosalvo,CARALHO FABRICIO LE O QUE EU ESCREVI!!! PELO AMOR DE DEUS FABRICIO!!! PRESTA ATENÇÃO NOQ VC LE!!!!!,2018-04-17 23:45:38+00:00,0,66,,
naosalvo,"E eu que sai de casa SÓ PARA comprar saco de lixo. Cheguei no carrefour, fiquei 40min, gastei 102 reais e voltei pra casa sem saco de lixo. Esqueci. Eu sou um lixo vsf",2018-04-17 23:43:04+00:00,40,1355,,
naosalvo,Eu disse q queria sem picles kct,2018-04-17 22:29:25+00:00,263,1443,,
naosalvo,Match!,2018-04-17 20:00:46+00:00,1173,4430,,
naosalvo,Só tomar Novalgina kakakakakakavem dezap,2018-04-17 18:42:53+00:00,3,81,,
naosalvo,#AecioPresoQuandoDer,2018-04-17 18:38:00+00:00,129,499,,#AecioPresoQuandoDer
naosalvo,A Tokyo parece mais bonita na TV,2018-04-17 17:42:43+00:00,7,253,,
naosalvo,HAAHHAHAHAHA Vrau Vrau Vraaaauuuu,2018-04-17 17:28:27+00:00,101,741,,
naosalvo,Só vi verdades,2018-04-17 16:42:09+00:00,1,60,,
naosalvo,Doido,2018-04-17 16:22:36+00:00,0,25,,
naosalvo,Passou da 13h Perceba que quem é gente do bem já almoçou. Só os mau caráter sem futuro vagabundo que ainda não. To com fome.,2018-04-17 16:20:57+00:00,188,1177,,
naosalvo,Conheça a onda dos Memes dublados. Oq ta virando a internet br????? https://twitter.com/wesleymir/status/986218264782168064,2018-04-17 16:08:32+00:00,43,387,,
naosalvo,Sua cabeça ta coçando,2018-04-17 16:06:52+00:00,30,147,,
naosalvo,Boa Erickson Quem sabe sabe,2018-04-17 05:43:44+00:00,1,65,,
naosalvo,"-boa noite -bjs -gosto mto de vc -eu tb gosto mto de vc -durma bem -vc tb -boa noite -te amo -tb te amo -boa noite -boa noite -fui -bjs -bjs -boa noite -ate amanha -acorda cedo amanha? -sim, tenho aula -de que Mais 3 horas de conversa -boa noite -bjs -gosto mt de vc -eu tb g",2018-04-17 05:34:17+00:00,605,2967,,
naosalvo,Essa pergunta pode parecer específica mas tem um fundo científico. Se você fosse uma mãe solteira de 42 anos transaria com o Pedro Bial após um encontro ao acaso de tarde em um bistrô no RJ? Obs. Bial esta com dor no quadril.,2018-04-17 04:23:07+00:00,21,81,,
naosalvo,Atitude desesperada da madrugada: Estou fazendo pipoca sem motivo aparente.,2018-04-17 04:08:17+00:00,14,396,,
naosalvo,Ultina prova de lider do BBB e fazem uma tosca dessas? Bem melhor quando colavam os participantes de cabeça pra baixo ao inves de só colar telefone,2018-04-17 02:11:41+00:00,80,581,,
naosalvo,O BBB perdeu um grande personagem carismatico no jogo. A mãe do Breno.,2018-04-17 01:50:38+00:00,1515,5185,,
naosalvo,Confie no seu publico e não dependa da plataforma,2018-04-17 01:43:50+00:00,1,34,,
naosalvo,Ainda ta na moda homem fazer boquete samurai?,2018-04-17 01:29:24+00:00,127,532,,
naosalvo, ,2018-04-17 00:38:21+00:00,6,70,,
naosalvo,Coitado do Haroldo https://twitter.com/RicardoEletro/status/985953239215505413,2018-04-16 23:52:24+00:00,50,399,,
naosalvo,Parece cena de filme hahauahvavavavahah,2018-04-16 23:34:54+00:00,38,163,,
naosalvo,Sem o audio achei que era o Professor da Casa de Papel,2018-04-16 22:07:41+00:00,0,237,,
naosalvo,Quarta feira a gente abre a lojinha hahahahahahahaha segura a periquita ai,2018-04-16 18:46:39+00:00,233,2457,,
naosalvo,A Melhor Novela de Todos os Tempos: http://youtu.be/ikV3wknlHiE?a via @YouTube,2018-04-16 18:36:16+00:00,5,37,@YouTube,
naosalvo,HAHAHAHAHAHHAHAHSHHAHSHSHAHAHAHHAAHHAHAHAAH MEOOOOODEOS,2018-04-16 18:25:26+00:00,132,3098,,
naosalvo,Ousado Esposa encontra marido na zona e ele aproveita últimos momentos de vida pra dançar,2018-04-16 17:51:35+00:00,17,159,,
naosalvo,Essas eleições prometem,2018-04-16 16:30:51+00:00,1026,3534,,
naosalvo,No momento assistindo trechos de Kubanacan pra fechar um vídeo. Que ótimo momento para de estar vivo.,2018-04-16 16:23:54+00:00,4,256,,
naosalvo,Hoje eu acordei mais confuso que a Anitta,2018-04-16 15:45:32+00:00,215,1162,,
naosalvo,Oficialmente viciado no funk da Casa de Papel ,2018-04-16 04:36:11+00:00,151,1083,,
naosalvo,Marcio Canuto,2018-04-16 01:27:00+00:00,279,3049,,
naosalvo,O jeito certo de comer sobremesa na casa da avó,2018-04-15 23:52:18+00:00,86,737,,
naosalvo,Oh ai @AvrilLavigne tem que fazer assim,2018-04-15 21:35:36+00:00,28,482,@AvrilLavigne,
naosalvo,Temos uma geração andando por ai sem referências do que é TV Cruj. Inadmissível...,2018-04-15 17:22:01+00:00,363,2097,,
naosalvo,Adios Natal! Primeira vez no Rio Grande do Norte foi daora boy :),2018-04-15 14:08:56+00:00,3,299,,
naosalvo,Hahahaha,2018-04-15 14:07:51+00:00,0,0,,
naosalvo,Hahahahah,2018-04-15 13:54:16+00:00,0,1,,
naosalvo,Mas falando serio agora... Uma prova que o povo fica 40h seguidas sem dormir é foda. Parece eu no carnaval,2018-04-14 18:19:50+00:00,36,389,,
naosalvo,Querem saber como vai acabar essa prova? Kaysar fingindo um desmaio. Vai vendo.,2018-04-14 18:16:52+00:00,15,279,,
naosalvo,Os caras tão passando a prova do BBB em looping e os troxao tudo acreditando oh la.... Boninho ta rindo pra kct de vcs,2018-04-14 18:14:22+00:00,51,770,,
naosalvo,Absurdo,2018-04-14 10:44:22+00:00,0,9,,
naosalvo,Haja,2018-04-14 10:41:40+00:00,118,995,,
naosalvo,Hahahava,2018-04-14 00:52:25+00:00,0,1,,
naosalvo,Que papo é esse q hoje é dia do bojo?,2018-04-14 00:44:04+00:00,31,229,,
naosalvo,Achei que vc não iria gostar,2018-04-14 00:15:55+00:00,1,94,,
naosalvo,Justo hahahah,2018-04-14 00:13:51+00:00,0,6,,
naosalvo,Faz moonwalk amanhã que zera,2018-04-14 00:06:35+00:00,4,237,,
